{
  "$schema": "../connector.schema.json",
  "schemaVersion": 1,
  "id": "azure",
  "version": "2.0.0",
  "apiVersion": "1.0.0",
  "kind": "cloud",
  "publisher": "ezcloud",
  "engines": { "kervik": ">=2.0.0 <3.0.0", "ezcloud": ">=2.0.0 <3.0.0" },
  "runtime": { "type": "builtin", "entrypoint": "host:azure" },
  "name": "Microsoft Azure",
  "description": "Local Microsoft Azure connection and credential storage.",
  "icon": "cloud.fill",
  "provides": {
    "operations": ["azure.credentials.read", "azure.credentials.write", "azure.credentials.delete"]
  }
}
