{
  "$schema": "../connector.schema.json",
  "schemaVersion": 1,
  "id": "aws",
  "version": "2.0.0",
  "apiVersion": "1.0.0",
  "kind": "cloud",
  "publisher": "ezcloud",
  "engines": { "kervik": ">=2.0.0 <3.0.0", "ezcloud": ">=2.0.0 <3.0.0" },
  "runtime": { "type": "builtin", "entrypoint": "host:aws" },
  "name": "Amazon Web Services",
  "description": "Local AWS connection and credential storage.",
  "icon": "cloud.fill",
  "provides": {
    "operations": [
      "aws.credentials.read",
      "aws.credentials.write",
      "aws.credentials.delete",
      "aws.sso.profiles.discover",
      "aws.sso.login",
      "aws.sso.profiles.sync",
      "aws.ec2.launchTemplates.read",
      "aws.ec2.launchTemplates.write"
    ]
  }
}
